{
  "schema": "PREDICTION_BRIDGE_COMMAND_V1",
  "task_id": "DEV-FG-RERUN-LONG-20261005-E018",
  "action": "SIX_AI_HEALTH",
  "created_at_utc": "2026-10-05T12:50:00Z",
  "route_task_id": "DEV-FG-TIMEOUT-DIAG-20261005-E017",
  "delivery_mode": "chat",
  "live_trading": false,
  "paid_actions": false,
  "wallet_actions": false,
  "intelligence_tier": "C",
  "issuer": {
    "model": "GPT-5.6 Sol",
    "reasoning_level": "UNAVAILABLE_TO_RUNTIME"
  },
  "notes": "Start the existing RAW privacy rerun as a transient user service with a 45-minute ceiling so the bridge's 15-minute per-command timeout no longer kills it."
}
