{
  "schema": "PREDICTION_BRIDGE_COMMAND_V1",
  "task_id": "DEV-PRED-RESULT-DRIVE-PREFLIGHT-20261001-E014",
  "action": "SIX_AI_HEALTH",
  "created_at_utc": "2026-10-01T10:16:00Z",
  "delivery_mode": "headless",
  "live_trading": false,
  "paid_actions": false,
  "wallet_actions": false,
  "intelligence_tier": "A",
  "issuer": {
    "model": "GPT-5.6 Sol",
    "reasoning_level": "UNAVAILABLE_TO_RUNTIME"
  },
  "notes": "Read-only preflight for Tampermonkey-free result return through an existing locally synced Google Drive folder. Detect likely Drive Desktop install/sync paths only; no external writes, credentials, trading, wallet or paid actions."
}
