{
  "schema": "PREDICTION_BRIDGE_COMMAND_V1",
  "task_id": "BRIDGE-THIS-CHAT-ROUTE-VERIFY-20260930-E016",
  "action": "BRIDGE_PING",
  "route_task_id": "SESSION-ROUTE-06b02c18b66873daa2c4548a",
  "live_trading": false,
  "paid_actions": false,
  "wallet_actions": false,
  "intelligence_tier": "C",
  "issuer": {
    "model": "GPT-5.6 Sol",
    "reasoning_level": "UNAVAILABLE_TO_RUNTIME"
  },
  "created_at_utc": "2026-09-30T06:25:00Z",
  "notes": "Verify canonical same-chat route before resuming projectexecutor work. No project mutation."
}
