{
  "schema": "PREDICTION_BRIDGE_COMMAND_V1",
  "task_id": "DEV-FG-INBOX-WATCHER-DIAG-20261005-E041",
  "action": "SIX_AI_HEALTH",
  "created_at_utc": "2026-10-05T14:12:00Z",
  "route_task_id": "DEV-FG-CLEAN-RESTART-BUTTONFIX-R2-20261005-E040",
  "delivery_mode": "chat",
  "live_trading": false,
  "paid_actions": false,
  "wallet_actions": false,
  "intelligence_tier": "C",
  "issuer": {
    "model": "GPT-5.6 Sol",
    "reasoning_level": "UNAVAILABLE_TO_RUNTIME"
  },
  "notes": "Read-only inspect whether normal FG watcher is running and whether files remain unclaimed in inbox."
}
