{
  "schema": "PREDICTION_BRIDGE_COMMAND_V1",
  "task_id": "DEV-PRED-REPAIR-SWITCH-MAIN-DIAG-20261004",
  "action": "SIX_AI_HEALTH",
  "created_at_utc": "2026-10-04T18:38:00Z",
  "live_trading": false,
  "paid_actions": false,
  "wallet_actions": false,
  "intelligence_tier": "A",
  "issuer": {"model": "GPT-5.6 Sol", "reasoning_level": "high"},
  "route_task_id": "SESSION-ROUTE-de3de7314761bf679ddd6aeb"
}
