{
  "schema": "PREDICTION_BRIDGE_COMMAND_V1",
  "task_id": "DEV-PRED-CONT-NEXT-6652a2c228e5d100e19a52fa",
  "action": "SIX_AI_HEALTH",
  "created_at_utc": "2026-10-03T14:29:30Z",
  "route_task_id": "DEV-PRED-PUBLICATION-ACCEPTANCE-20261003-E055",
  "live_trading": false,
  "paid_actions": false,
  "wallet_actions": false,
  "intelligence_tier": "A",
  "issuer": {
    "model": "GPT-5.6 Sol",
    "reasoning_level": "UNAVAILABLE_TO_RUNTIME"
  },
  "auto_continue": true,
  "parent_continuation_id": "CONT-6652a2c228e5d100e19a52fa"
}
