{
  "schema": "PREDICTION_BRIDGE_COMMAND_V1",
  "task_id": "DEV-PRED-REDDIT-COMMENT-COVERAGE-20261008-E025",
  "action": "SIX_AI_HEALTH",
  "created_at_utc": "2026-10-08T18:19:35.025Z",
  "route_task_id": "SESSION-ROUTE-74c664afabf31305265af34b",
  "delivery_mode": "chat",
  "live_trading": false,
  "paid_actions": false,
  "wallet_actions": false,
  "intelligence_tier": "B",
  "issuer": {
    "model": "GPT-6",
    "reasoning_level": "UNAVAILABLE_TO_RUNTIME"
  },
  "auto_continue": false,
  "notes": "E025 full offline Reddit source and Recon tests including rotated community comment coverage. No live network or trading."
}
