{
  "schema": "PREDICTION_BRIDGE_COMMAND_V1",
  "task_id": "CONT-DONE-4d9695d6eb5dbfa81c61bb5b",
  "action": "BRIDGE_PING",
  "created_at_utc": "2026-10-07T20:56:00Z",
  "route_task_id": null,
  "delivery_mode": "headless",
  "live_trading": false,
  "paid_actions": false,
  "wallet_actions": false,
  "intelligence_tier": "C",
  "issuer": {
    "model": "GPT-5.6 Sol",
    "reasoning_level": "UNAVAILABLE_TO_RUNTIME"
  },
  "notes": "Close superseded N1E75 continuation. Its exact attempt-5 retry_at/checkpoint result was already durably advanced to retry gate DEV-PRED-A2Z-R4P2-ASTRA-RETRY5-EXACT-20261007-N1E76. No duplicate NEXT or Astra resume is authorized.",
  "auto_continue": false,
  "parent_continuation_id": "CONT-4d9695d6eb5dbfa81c61bb5b"
}
