{
  "schema": "PREDICTION_BRIDGE_COMMAND_V1",
  "task_id": "DEV-PRED-CONTROL-CENTER-SYNC-LIVE-20261005-E021",
  "action": "SIX_AI_HEALTH",
  "created_at_utc": "2026-10-05T18:31:00Z",
  "route_task_id": "SESSION-ROUTE-fc2613ecbc81e22d4c913b2a",
  "delivery_mode": "chat",
  "live_trading": false,
  "paid_actions": false,
  "wallet_actions": false,
  "intelligence_tier": "B",
  "issuer": {
    "model": "GPT-5.6 Sol",
    "reasoning_level": "UNAVAILABLE_TO_RUNTIME"
  },
  "auto_continue": false,
  "parent_continuation_id": null,
  "notes": "Deploy active sync visibility on Live/Overview. Require full Control Center regressions, runtime install, active service and canary PASS."
}
