{
  "schema": "PREDICTION_BRIDGE_COMMAND_V1",
  "task_id": "DEV-PRED-AUTONOMY-LIVE-STATUS-20261003-E037",
  "action": "SIX_AI_HEALTH",
  "created_at_utc": "2026-10-03T11:20:00Z",
  "route_task_id": "DEV-PRED-CONT-NEXT-9b1344c6c56575a880022a46",
  "live_trading": false,
  "paid_actions": false,
  "wallet_actions": false,
  "intelligence_tier": "C",
  "issuer": {
    "model": "GPT-5.6 Sol",
    "reasoning_level": "UNAVAILABLE_TO_RUNTIME"
  }
}
