{
  "schema": "PREDICTION_BRIDGE_COMMAND_V1",
  "task_id": "CONT-DONE-5d70b2300c603b6ac904bcc1",
  "action": "BRIDGE_PING",
  "created_at_utc": "2026-10-07T20:51:30Z",
  "route_task_id": null,
  "delivery_mode": "headless",
  "live_trading": false,
  "paid_actions": false,
  "wallet_actions": false,
  "intelligence_tier": "C",
  "issuer": {
    "model": "GPT-5.6 Sol",
    "reasoning_level": "UNAVAILABLE_TO_RUNTIME"
  },
  "notes": "Close superseded N1E74 continuation. Its rc=30 usage-limit outcome was already durably advanced to N1E75, which extracts the latest exact retry window for R4P2. No duplicate NEXT or Astra resume is authorized.",
  "auto_continue": false,
  "parent_continuation_id": "CONT-5d70b2300c603b6ac904bcc1"
}
