{
  "schema": "PREDICTION_BRIDGE_COMMAND_V1",
  "task_id": "DEV-PRED-CONT-NEXT-c86e5465f8751eb27e430668",
  "action": "SIX_AI_HEALTH",
  "created_at_utc": "2026-10-05T13:35:10Z",
  "route_task_id": "DEV-PRED-PROD-SNAPSHOT-FF-20261005-E024",
  "delivery_mode": "chat",
  "live_trading": false,
  "paid_actions": false,
  "wallet_actions": false,
  "intelligence_tier": "C",
  "issuer": {
    "model": "GPT-5.6 Sol",
    "reasoning_level": "UNAVAILABLE_TO_RUNTIME"
  },
  "notes": "Read-only verify E024 production reconciliation and inspect its durable staged snapshot after result ACK timeout.",
  "auto_continue": true,
  "parent_continuation_id": "CONT-c86e5465f8751eb27e430668"
}
