{
  "schema": "PREDICTION_BRIDGE_COMMAND_V1",
  "task_id": "DEV-PRED-ASTRA-RESULT-NORMALIZE-R5-20261008-N1E132",
  "action": "SIX_AI_HEALTH",
  "created_at_utc": "2026-10-08T06:32:00Z",
  "route_task_id": "SESSION-ROUTE-246799adf99f0bf8336c27a0",
  "live_trading": false,
  "paid_actions": false,
  "wallet_actions": false,
  "intelligence_tier": "A",
  "issuer": {
    "model": "GPT-5.6 Sol",
    "reasoning_level": "High"
  },
  "auto_continue": true
}
