{
  "schema": "PREDICTION_BRIDGE_COMMAND_V1",
  "task_id": "CONT-DONE-c639360f2d437118a78fe323",
  "action": "BRIDGE_PING",
  "created_at_utc": "2026-10-08T10:25:15Z",
  "route_task_id": null,
  "delivery_mode": "headless",
  "live_trading": false,
  "paid_actions": false,
  "wallet_actions": false,
  "intelligence_tier": "C",
  "issuer": {
    "model": "GPT-5.6 Sol",
    "reasoning_level": "UNAVAILABLE_TO_RUNTIME"
  },
  "notes": "Close superseded continuation. The N1E135 diagnostic lineage has already advanced to the bounded R4P3 queue diagnostic DEV-PRED-A2Z-R4P3-QUEUE-BOUNDED-DIAG-20261008-N1E140. No duplicate NEXT.",
  "auto_continue": false,
  "parent_continuation_id": "CONT-c639360f2d437118a78fe323"
}
