{
  "schema": "PREDICTION_BRIDGE_COMMAND_V1",
  "task_id": "DEV-PRED-CONT-NEXT-16e1c669d793daa6f974ac4a",
  "action": "SIX_AI_HEALTH",
  "created_at_utc": "2026-10-03T16:45:00Z",
  "route_task_id": "DEV-PRED-CONT-NEXT-cb7065b8d238698be2eed843",
  "live_trading": false,
  "paid_actions": false,
  "wallet_actions": false,
  "intelligence_tier": "A",
  "issuer": {
    "model": "GPT-5.6 Sol",
    "reasoning_level": "UNAVAILABLE_TO_RUNTIME"
  },
  "auto_continue": true,
  "parent_continuation_id": "CONT-16e1c669d793daa6f974ac4a"
}
