{
  "schema": "PREDICTION_BRIDGE_COMMAND_V1",
  "task_id": "DEV-PRED-CONT-INFLIGHT-RANK-20261003-E032",
  "action": "SIX_AI_HEALTH",
  "created_at_utc": "2026-10-03T09:30:00Z",
  "route_task_id": "DEV-PRED-CONT-HEARTBEAT-LIVE-STATE-20261003-E031",
  "live_trading": false,
  "paid_actions": false,
  "wallet_actions": false,
  "intelligence_tier": "C",
  "issuer": {
    "model": "GPT-5.6 Sol",
    "reasoning_level": "UNAVAILABLE_TO_RUNTIME"
  }
}
