{
  "schema": "PREDICTION_BRIDGE_COMMAND_V1",
  "task_id": "DEV-PRED-PROD-STAGED-SUMMARY-C-20261005-E022",
  "action": "SIX_AI_HEALTH",
  "created_at_utc": "2026-10-05T12:27:00Z",
  "route_task_id": "SESSION-ROUTE-b277b86c3ff1b5ff38f678be",
  "delivery_mode": "chat",
  "live_trading": false,
  "paid_actions": false,
  "wallet_actions": false,
  "intelligence_tier": "A",
  "issuer": {
    "model": "GPT-5.6 Sol",
    "reasoning_level": "UNAVAILABLE_TO_RUNTIME"
  },
  "notes": "Compact read-only staged semantic summary; intentional FAIL detail expected.",
  "auto_continue": true,
  "parent_continuation_id": null
}
