{
  "schema": "PREDICTION_BRIDGE_COMMAND_V1",
  "task_id": "DEV-PRED-INDEPENDENT-CONTINUITY-SERVICE-STATUS-20261008-E010",
  "action": "SIX_AI_HEALTH",
  "created_at_utc": "2026-10-08T18:40:43.336Z",
  "route_task_id": "SESSION-ROUTE-88ba3ef9802e307c74102659",
  "live_trading": false,
  "paid_actions": false,
  "wallet_actions": false,
  "intelligence_tier": "C",
  "issuer": {
    "model": "GPT-6",
    "reasoning_level": "UNAVAILABLE_TO_RUNTIME"
  },
  "notes": "Read-only E010 retry. No source, bridge, executor or runtime changes."
}
