{"schema":"PREDICTION_BRIDGE_COMMAND_V1","task_id":"DEV-PRED-AUTOBUILD-BUILD-20260930-E035","action":"SIX_AI_HEALTH","created_at_utc":"2026-09-30T09:07:00Z","route_task_id":"SESSION-ROUTE-edac2e83ad5b59e720cfab3a","live_trading":false,"paid_actions":false,"wallet_actions":false,"intelligence_tier":"A","issuer":{"model":"GPT-5.6 Sol","reasoning_level":"UNAVAILABLE_TO_RUNTIME"},"notes":"Run guard FD regression canary, then generic autobuild targeted/wiring/full tests and local commit. No live/cost/wallet/credential/remote-git action."}
